{
  "schema_version": "liqi.database.backup-repository-capacity/v1",
  "git_sha": "aaaaaaaaaaaaaaaaaaaaaaaaaaaaaaaaaaaaaaaa",
  "observed_at": "2026-07-18T00:00:00Z",
  "authority": "independent-management-storage",
  "repository_ref": "management://database-backup-repository",
  "filesystem": {
    "path": "/independent-storage/pgbackrest/liqi",
    "total_bytes": 536870912000,
    "used_bytes": 107374182400,
    "available_bytes": 429496729600,
    "reserved_bytes": 21474836480
  },
  "transport": {
    "kind": "mutual-tls-over-wireguard",
    "port": 8432,
    "publicly_exposed": false
  },
  "status": "passed"
}
